{
  "home": {
    "meta": {
      "title": "Modern Chinese kitchen",
      "description": "Jade & Ember is a fictional modern Chinese kitchen: a cinematic restaurant website concept by Simplified Tech Solutions. Sample menu, hours and address."
    },
    "hero": {
      "eyebrow": "Modern Chinese kitchen",
      "headline": [
        "The breath",
        "of the wok."
      ],
      "text": "Carbon steel, a flame at full height, and a kitchen that cooks to the second. Tuesday to Sunday, from five.",
      "primaryCta": {
        "label": "See the menu",
        "page": "menu"
      },
      "caption": "Wok-seared beef, broccoli, red chili",
      "image": {
        "desktop": "media/hero-wok-v2.webp",
        "mobile": "media/hero-wok-v2-m.webp",
        "width": 1928,
        "height": 1072,
        "mobileWidth": 810,
        "mobileHeight": 1440,
        "alt": "A carbon steel wok over a gas burner, blue and orange flames curling around its base, sliced beef, broccoli and red chili sizzling inside, in a dark kitchen.",
        "focusDesktop": "34% 50%",
        "focusMobile": "72% 62%"
      },
      "video": {
        "webm": "media/hero-wok-v2.webm",
        "mp4": "media/hero-wok-v2.mp4",
        "width": 1928,
        "height": 1072,
        "loopSeconds": 5.04
      }
    },
    "process": {
      "heading": "Heat is the ingredient.",
      "body": "Wok hei, the breath of the wok, is the smoky, singed sweetness that only comes from food moving fast over a very hot flame. Four things make it, and we cook around all of them.",
      "steps": [
        {
          "name": "Fire",
          "text": "A burner kept at full height, so the pan never has time to cool."
        },
        {
          "name": "Steam",
          "text": "Wine and stock flash at the wall of the wok and lift the aroma into the dish."
        },
        {
          "name": "Texture",
          "text": "Small cuts, dry ingredients, and a toss that never stops. Crisp stays crisp."
        },
        {
          "name": "The plate",
          "text": "Out of the wok and onto jade or slate within seconds, while it is still singing."
        }
      ]
    },
    "signature": {
      "heading": "Order these first.",
      "moreLabel": "See the full menu"
    },
    "storyTeaser": {
      "text": "The room is charcoal and slate, lit low, with celadon bowls stacked on the pass. Every dish gets its turn at the fire.",
      "linkLabel": "Read our story",
      "sample": false
    },
    "visitStrip": {
      "heading": "Find the kitchen",
      "linkLabel": "Plan your visit"
    },
    "orderBand": {
      "heading": "Dinner, to go.",
      "text": "Choose from the full menu and collect it hot from the pass."
    }
  },
  "menu": {
    "meta": {
      "title": "Sample menu",
      "description": "The sample menu at Jade & Ember, a fictional modern Chinese kitchen: small plates, wok dishes, noodles and rice, roast and braise, sweet and tea, with heat levels and allergens."
    },
    "h1": "Sample menu",
    "note": "Please tell us about allergies when ordering: peanuts, sesame, soy, wheat, shellfish and egg appear throughout.",
    "legend": {
      "heading": "Heat",
      "levels": [
        "warm",
        "hot",
        "fierce"
      ]
    },
    "band": {
      "src": "media/hero-wok-v2.webp",
      "width": 1928,
      "height": 1072,
      "alt": "",
      "pos": "60% 40%",
      "decorative": true
    },
    "orderBand": {
      "heading": "Dinner, to go.",
      "text": "Choose from the menu and collect it hot from the pass."
    }
  },
  "story": {
    "meta": {
      "title": "Our story",
      "description": "The story of Jade & Ember, a fictional modern Chinese kitchen built around one very hot wok."
    },
    "h1": "A small kitchen, one very hot wok.",
    "image": {
      "src": "media/story-jade-bowls.webp",
      "width": 1200,
      "height": 757,
      "alt": "Three stacked jade-green celadon bowls beside a bowl of steamed white rice on a matte black plate, on a slate board."
    },
    "caption": "Celadon rice bowls, stacked on the pass.",
    "chapters": [
      {
        "id": "question",
        "heading": "The question",
        "sample": true,
        "paragraphs": [
          "Jade & Ember began as a question about a single flame: what if a dining room felt like standing beside a wok at full heat, without the noise or the smoke?",
          "The answer was not a bigger kitchen. It was a smaller one, with the burner close enough to feel and a counter where you can watch the pan do its work."
        ]
      },
      {
        "id": "room",
        "heading": "The room",
        "sample": true,
        "paragraphs": [
          "The room is charcoal and slate, lit low, with celadon bowls stacked on the pass. Nothing is bright except the flame.",
          "The wok counter seats eight, so the quickest way to understand the menu is to sit where the cooking happens."
        ]
      },
      {
        "id": "wok",
        "heading": "The wok",
        "sample": true,
        "paragraphs": [
          "The kitchen cooks Cantonese and Sichuan dishes with a lighter hand. A carbon steel wok is seasoned until it is nearly black, then kept hotter than a home stove can reach.",
          "That heat gives wok hei, the smoky, singed sweetness this place is named for. It is also why the menu stays short: every dish gets its turn at the fire."
        ]
      }
    ],
    "name": {
      "heading": "The name",
      "sample": true,
      "characters": [
        "玉",
        "火"
      ],
      "line": "Jade for the bowls, ember for the flame. The name is the whole palette.",
      "note": "玉 is the character for jade. 火 is the character for fire."
    },
    "orderBand": {
      "heading": "Taste the fire.",
      "text": "Start with the menu, then collect it hot from the pass.",
      "secondary": {
        "page": "menu",
        "label": "See the menu"
      }
    }
  },
  "visit": {
    "meta": {
      "title": "Visit us",
      "description": "Address, opening hours and how to find Jade & Ember, a fictional modern Chinese kitchen (all details are samples)."
    },
    "h1": "Visit us (sample details)",
    "fictionalNote": "Fictional address, phone number and hours. Please do not travel or call.",
    "directionsLabel": "Get directions",
    "goodToKnow": {
      "heading": "Good to know",
      "groups": [
        {
          "title": "Seating",
          "items": [
            "Walk-ins are welcome; the wok counter seats eight."
          ]
        },
        {
          "title": "Takeaway",
          "items": [
            "Takeaway orders are placed through the online-ordering page."
          ],
          "link": {
            "page": "order",
            "label": "Order online"
          }
        },
        {
          "title": "Getting here",
          "sample": true,
          "items": [
            "Example Street is a five-minute walk from the Sample Street tram stop.",
            "Street parking is available on Example Street after 6 pm."
          ]
        },
        {
          "title": "Access",
          "sample": true,
          "items": [
            "The entrance is step-free. Tell us when you book a counter seat if you need a chair with a back."
          ]
        }
      ]
    },
    "orderBand": {
      "heading": "Dinner, to go.",
      "text": "Choose from the full menu and collect it hot from the pass."
    }
  },
  "order": {
    "meta": {
      "title": "Order online",
      "description": "How ordering works at Jade & Ember, a fictional modern Chinese kitchen (the ordering button is a nonfunctional example)."
    },
    "h1": "Dinner, to go.",
    "text": "Choose from the full menu and collect it hot from the pass.",
    "stepsHeading": "How ordering works",
    "steps": [
      {
        "name": "Choose",
        "text": "Pick your dishes from the menu.",
        "link": {
          "page": "menu",
          "label": "See the menu"
        },
        "station": "Wok"
      },
      {
        "name": "Order and pay",
        "text": "Order on {platform}. Payment is taken there, not on this site.",
        "station": "Pass"
      },
      {
        "name": "Collect",
        "text": "Come to the pass and we hand it over hot. {pickup}",
        "station": "You"
      }
    ],
    "pickup": {
      "heading": "Pickup",
      "text": "Orders are collected at the pass during opening hours.",
      "link": {
        "page": "visit",
        "label": "See hours and address"
      }
    },
    "allergy": {
      "heading": "Allergies"
    },
    "phone": {
      "heading": "Prefer to call?"
    },
    "newTab": "(opens the restaurant's ordering page in a new tab)"
  },
  "demo": {
    "ownerNoteTitle": "For restaurant owners",
    "demoNote": "This is a nonfunctional example. A live Jade & Ember would send this button to its own online-ordering page. In this concept that page is set in config.json (ordering.url) and is currently empty, so nothing can be ordered and no payment is taken.",
    "platformNote": "Designed for restaurants that already take orders through a MenuSifu page. No MenuSifu integration, embed or partnership has been built or verified here; the button simply links out.",
    "exampleSuffix": "(example)",
    "menuSample": "Sample menu with invented prices in fictional dollars.",
    "heroCaptionNote": ". AI-generated concept image and video."
  }
}
